Company,Amount,Funding Round,Vertical,Link,Investors,Category,Source,Date
Marvel Fusion,$54M,Series A,Clean Energy Fusion,,"EQT Ventures, Siemens Energy Ventures, European Innovation Council Fund, Tengelmann Ventures, Bayern Kapital",other,Fortune Term Sheet,2025-03-28
Mendel,$35M,Series B,Enterprise spend management,,"Base10 Partners, PayPal Ventures, Endeavor Catalyst, Infinity Ventures, Industry Ventures, Hi.vc",fintech,Fortune Term Sheet,2025-03-28
Manna Air Delivery,$30M,Series Unknown,Drone Delivery,,"Molten Ventures, Tapestry VC, Coca-Cola HBC, Dynamo VC, Radius Capital",other,Fortune Term Sheet,2025-03-28
Galatea Bio,$25M,Series Unknown,genomic research biotech,,"F-Prime, Helios Digital Ventures, Digitalis Ventures, and others",healthcare,Fortune Term Sheet,2025-03-28
Layer Health,$21M,Series A,AI-powered medical chart review,,"Define Ventures, Flare Capital Partners, GV, MultiCare Capital Partners",healthcare,Fortune Term Sheet,2025-03-28
GetReal Security,$17.5M,Series A,generative AI cybersecurity,,"Forgepoint Capital, Ballistic Ventures, Evolution Equity, K2 Access Fund, and others",Other,Fortune Term Sheet,2025-03-28
DeepIP,$15M,Series A,AI-powered patent assistance,,"Resonance, Headline, Serena Capital, Balderton Capital",other,Fortune Term Sheet,2025-03-28
Allen Control Systems,$30M,Series A,gun turret technology,,"Craft Ventures, Inspired Capital, Rally Ventures",other,Fortune Term Sheet,2025-03-28
Yutori,$15M,Seed,personal AI assistants,,"Radical Ventures, Felicis, and angel investors",other,Fortune Term Sheet,2025-03-28
BuildVision,$10M,Series A,construction procurement,,"Norwest Venture Partners, Crosslink Capital",other,Fortune Term Sheet,2025-03-28
WunderGraph,$7.5M,Series A,GraphQL federation platform,,"Karma Ventures, eBay Ventures, Aspenwood Ventures",other,Fortune Term Sheet,2025-03-28
Chord Commerce,$5.5M,Series unspecified,customer data platform,,"M13, Act One Ventures, GR0 Capital",commerce,Fortune Term Sheet,2025-03-28
Taxo,$5M,Seed,Healthcare administration data,,"Y Combinator, General Catalyst, Character, angel investors",healthcare,Fortune Term Sheet,2025-03-28
Ethos,$3.3M,Series unspecified,AI-powered expert matching,,"General Catalyst, 8VC, Conviction, Common Magic, Interface Capital, and angel investors",other,Fortune Term Sheet,2025-03-28
Marit Health,$3.2M,Seed,Clinician salary sharing,,"Define Ventures, others",healthcare,Fortune Term Sheet,2025-03-28
Mercury,$300M,Series C,financial workflow solutions,,"Sequoia Capital, Spark Capital, Marathon, Coatue, CRV, Andreessen Horowitz",fintech,Fortune Term Sheet,2025-03-28
AMBOSS,$258.6M,Series,Medical Education & Decision Making,,"KIRKBI, M&G Investments, Lightrock, Partech",healthcare,Fortune Term Sheet,2025-03-28
Island,$250M,Series E,enterprise workspace development,,"Coatue Management, others",other,Fortune Term Sheet,2025-03-28
Also,$105M,Series B,small electric vehicles,,Eclipse,other,Fortune Term Sheet,2025-03-28
Underdog,$70M,Series C,Sports gaming,,Spark Capital,other,Fortune Term Sheet,2025-03-28
Straiker,$21M,Series Unknown,AI security solutions,,"Lightspeed Ventures, Bain Capital Ventures",other,Fortune Term Sheet,2025-03-28
Brisk Teaching,$15M,Series A,AI-powered teaching,,"Bessemer Venture Partners, Owl Ventures, South Park Commons, Springbank Collective",other,Fortune Term Sheet,2025-03-28
Lucky Energy,$14.2M,Series A1,energy drink company,,"Maveron, Daily Mail Ventures, Second Sight Ventures, Imaginary Ventures, Brand Foundry Ventures, Sapphire Ventures, and Sugar Capital",other,Fortune Term Sheet,2025-03-28
XGS Energy,$13M,Unspecified,geothermal power projects,,"Aligned Climate Capital, ClearSky, ClimateIC, WovenEarth Ventures, and others",other,Fortune Term Sheet,2025-03-28
Hakimo,$10.5M,Series A,physical security monitoring,,"Vertex Ventures, Zigg Capital, RXR Arden Digital Ventures, Defy.vc, Gokul Rajaram",other,Fortune Term Sheet,2025-03-28
Pineapple Academy,$1M,Unspecified,workforce development,,"HealthStream, KCRise Fund",other,Fortune Term Sheet,2025-03-28
Nexthop AI,$110M,Series Unknown,Cloud AI infrastructure,,"Lightspeed Venture Partners, Kleiner Perkins, WestBridge Capital, Battery Ventures, Emergent Ventures",other,Fortune Term Sheet,2025-03-28
Epicrispr Biotechnologies,$68M,Series B,Neuromuscular diseases treatment,,"Ally Bridge Group, SOLVE FSHD, others",healthcare,Fortune Term Sheet,2025-03-28
n8n,$59.4M,Series B,workflow automation platform,,"Highland Europe, HV Capital, Sequoia, Felicis, and Harpoon",other,Fortune Term Sheet,2025-03-28
Sunday,$30M,Series Unknown,Lawn Care Products,,"S2G, others",other,Fortune Term Sheet,2025-03-28
Silna Health,$27M,Series A,Healthcare prior authorization,,"Accel, Bain Capital Ventures, Activant, angel investors",healthcare,Fortune Term Sheet,2025-03-28
Dyna Robotics,$23.5M,Seed,AI-powered robots,,"CRV, First Round Capital, Sancus Capital, Umami Capital, Hardware Club",other,Fortune Term Sheet,2025-03-28
Paid,$10.8M,Pre-Seed,AI agent business platform,,"EQT Ventures, Sequoia, GTMFund",other,Fortune Term Sheet,2025-03-28
Sympera AI,$10M,Seed,banking relationship managers,,"Nyca Partners, Viola Ventures",fintech,Fortune Term Sheet,2025-03-28
SplxAI,$7M,Seed,Offensive AI security,,"LAUNCHub Ventures, Rain Capital, Inovo, Runtime Ventures",other,Fortune Term Sheet,2025-03-28
ai|coustics,$5.4M,Seed,Audio Reconstruction,,"Partech, Acurio, Intuition, Arc Investors, Connect, FOV Ventures, and angel investors",other,Fortune Term Sheet,2025-03-28
Nace.AI,$5M,Seed,Precision enterprise AI,,"General Catalyst, .406 Ventures, MVP Ventures, Coalition Partners",Other,Fortune Term Sheet,2025-03-28
Voiceops,$5M,Seed,marketing phone call analysis,,"Bonfire Ventures, Twelve Below, Precursor Ventures, Not Boring Capital, Village Global",other,Fortune Term Sheet,2025-03-28
Arlo,$4M,Seed,health insurance for SMBs,,"Upfront Ventures, 8VC, General Catalyst",healthcare,Fortune Term Sheet,2025-03-28
Lumi AI,$3.7M,Seed,enterprise resource planning data analytics,,"AgFunder, Forum Ventures, ADQ, Qora71, and angel investors",other,Fortune Term Sheet,2025-03-28
Iceberg Quantum,$1.2M,Pre-Seed,Quantum Computing,,"Blackbird Ventures, LocalGlobe",Other,Fortune Term Sheet,2025-03-28
Character Biosciences,$93M,Series B,eye diseases therapies,,"aMoon, Luma Group, Bausch + Lomb, Jefferson Life Sciences, Innovation Endeavors, Catalio Capital Management, S32, and KdT Ventures",healthcare,Fortune Term Sheet,2025-03-28
Navina,$55M,Series C,Clinical AI intelligence,,"Growth Equity at Goldman Sachs Alternatives, Vertex Ventures Israel, Grove Ventures, and ALIVE",healthcare,Fortune Term Sheet,2025-03-28
CamGraPhIC,$27M,Series A,Optical interconnect tech,,"CDP Venture Capital, NATO Innovation Fund, Sony Innovation Fund, Join Capital, Bosch Ventures, Frontier IP, Indaco Venture Partners",other,Fortune Term Sheet,2025-03-28
Arcade,$25M,Series A,Generative AI marketplace,,"Canaan Partners, Forerunner Ventures, Adverb Ventures, Factorial Funds, Reid Hoffman, Offline Ventures, Sound Ventures, angel investors, and others",other,Fortune Term Sheet,2025-03-28
Rain,$24.5M,Series Unknown,stablecoin-powered card issuing,,"Norwest Venture Partners, Galaxy Ventures, Goldcrest, Thayer, Hard Yaka, Lightspeed Venture Partners, Coinbase Ventures, Vinyl Capital",fintech,Fortune Term Sheet,2025-03-28
RockFi,$19.4M,Series A,wealth management platform,,"Partech, Varsity, and angel investors",fintech,Fortune Term Sheet,2025-03-28
EDGE Boost,$17.2M,Series Unknown,banking for gambling,,"Bullpen Capital, Step Stone Group, Suro Capital, Impulsum Ventures, and others",fintech,Fortune Term Sheet,2025-03-28
Browser Use,$17M,Seed,AI agent browser interface,,"Felicis, A Capital, SV Angel, Nexus Venture Partners, Paul Graham",other,Fortune Term Sheet,2025-03-28
Charm Security,$8M,Seed,AI-powered customer security,,Team8,other,Fortune Term Sheet,2025-03-28
Hunted Labs,$3M,Pre-Seed,Software supply chain security,,Red Cell Partners,other,Fortune Term Sheet,2025-03-28
BuildOps,$127M,Series C,commercial contractors platform,,"Meritech Capital Partners, BOND Capital, SE Ventures, Fika Ventures, Next47, StepStone Group, Titanium Ventures",other,Fortune Term Sheet,2025-03-28
Camber,$4M,Unspecified,Scientific research computing,,Base10 Partners,Other,Fortune Term Sheet,2025-03-28
Inspiren,$35M,Series A,AI-powered senior living,,"Avenir, Primary Venture Partners, Story Ventures, Third Prime, and Studio VC",other,Fortune Term Sheet,2025-03-28
Multiply Mortgage,$23.5M,Series A,Mortgage-as-a-benefit,,"Kleiner Perkins, A*, Box Group, Mischief, Workshop",fintech,Fortune Term Sheet,2025-03-28
Rerun,$17M,Seed,physical AI multimodal data,,"Point Nine, Sunflower Capital, Costanoa Ventures, Seedcamp",other,Fortune Term Sheet,2025-03-28
Kosli,$10M,Series A,software delivery governance,,"Deutsche Bank's Corporate Venture Capital group, Heavybit, Defined Capital, Transpose Platform, and angel investors",other,Fortune Term Sheet,2025-03-28
257,$9.2M,Seed,AI-powered energy platform,,"F2 Venture Capital, angel investors",other,Fortune Term Sheet,2025-03-28
Uranium Digital,$6.1M,Seed,Uranium trading platform,,"Framework Ventures, Karatage, Knollwood, angel investors, and others",other,Fortune Term Sheet,2025-03-28
Manifest,$2.5M,Pre-Seed,Real estate finance protocol,,"VanEck Ventures, Lattice Fund, Compound, SALT",fintech,Fortune Term Sheet,2025-03-28
Prowler,$12.5,Seed,open cloud security,https://vcnewsdaily.com/prowler/venture-capital-funding/swkhkjmslt,"Decibel VC, SNR, IrregEx, and a handful of prominent angel investors",other,VC News Daily,2025-04-03
TwinKnowledge,$3.7,Seed,real estate data,https://vcnewsdaily.com/twinknowledge/venture-capital-funding/wwtpdylpyb,"Camber Creek, Great Wave Ventures",fintech,VC News Daily,2025-04-03
Ropes,$3.1M,Seed,engineering talent evaluation,https://vcnewsdaily.com/ropes/venture-capital-funding/gwydskycrx,"GSV Ventures, Box Group",fintech,VC News Daily,2025-04-03
Emovid,$7,Seed,asynchronous communication,https://vcnewsdaily.com/emovid/venture-capital-funding/vtcstbgfvy,Not specified,other,VC News Daily,2025-04-03
Cyberhaven,$100,Series D,AI-powered data security,https://vcnewsdaily.com/cyberhaven/venture-capital-funding/qckvnxknnr,"StepStone Group, Schroders, Industry Ventures",other,VC News Daily,2025-04-03
Opsera,$20,Series B,AI-powered DevOps,https://vcnewsdaily.com/opsera/venture-capital-funding/rwkkwdxzdw,"Prosperity7, Hitachi Ventures",other,VC News Daily,2025-04-03
Actively AI Bags $17.5M Series A,$17.5M,Series A,Revenue team optimization,https://vcnewsdaily.com/actively-ai/venture-capital-funding/btyqwwgwnf,"Bain Capital Ventures, First Round Capital, Jason Boehmig, Ali Rowghani, Frederic Kerrest",fintech,VC News Daily,2025-04-03
Adaptive Security Bags $43M in Funding Round,$43M,Series?,AI-powered cybersecurity,https://vcnewsdaily.com/adaptive-security/venture-capital-funding/snzppjykmh,"Andreessen Horowitz (a16z) and the OpenAI Startup Fund, Abstract Ventures, Eniac Ventures, CrossBeam Ventures and K5, along with executives from Google, Workday, Shopify, Plaid, Paxos",Other,VC News Daily,2025-04-03
Hi Auto,$15M,Series A,AI voice technology,https://vcnewsdaily.com/hi-auto/venture-capital-funding/mmdrlmcsqj,"Delek Motors, the Zisapel Family, Vasuki Tech Fund, Allied Group, Goldbell Investments, and the Meir Barel Group",fintech,VC News Daily,2025-04-03
Aetherflux,50M,Series A,space solar power,https://techcrunch.com/2025/04/02/space-solar-startup-aetherflux-raises-50m-to-launch-first-space-demo-in-2026/,"Index Ventures, Interlagos, Breakthrough Energy Ventures, NEA, Andreessen Horowitz",other,Fortune Term Sheet,2025-04-03
Actively AI,$22.5M,Series A,GTM superintelligence,https://www.finsmes.com/2025/04/actively-ai-raises-22-5m-in-total-funding.html,"Bain Capital Ventures, First Round Capital",other,Fortune Term Sheet,2025-04-03
Fourier,$18.5M,Series A,hydrogen production systems,https://hydrogen-central.com/fourier-is-making-hydrogen-electrolyzers-inspired-by-data-centers-techcrunch/,"General Catalyst, Paramarck Ventures, Airbus Ventures, GSBackers, MCJ, and others",other,Fortune Term Sheet,2025-04-03
Djamo,$17M,Series A,Mobile banking app,https://www.finextra.com/newsarticle/45764/african-neobank-djamo-raises-17-million,"Janngo Capital, SANAD Fund for MSMEs, Partech, Oikocredit",fintech,Fortune Term Sheet,2025-04-03
Fairly Made,$16.3M,Series Unknown,Sustainable fashion solutions,https://www.bloomberg.com/news/articles/2021-12-20/bmo-agrees-to-buy-bnp-s-bank-of-the-west-for-16-3-billion,"BNP Paribas Solar Impulse Venture Fund, GET Fund, ETF Partners, and Frenchfounders",other,Fortune Term Sheet,2025-04-03
Roam,$11.5M,Series A,mortgage assumable marketplace,https://techcrunch.com/2025/04/02/khoslas-keith-rabois-leads-11-5m-series-a-for-startup-roam-calls-it-the-future-of-the-housing-market/,"Keith Rabois, Founders Fund",fintech,Fortune Term Sheet,2025-04-03
Parasail,$10M,Seed,AI deployment network,https://www.crunchbase.com/funding_round/parasail-seed--109a13f7,"Basis Set Ventures, Threshold Ventures, Buckley Ventures, Black Opal Ventures",other,Fortune Term Sheet,2025-04-03
Lumai,$10M,Series Unknown,AI-powered optical processing,https://startuprise.co.uk/lumai-raises-more-than-10million-in-funding/,"Constructor Capital, PhotonVentures, Journey Ventures, LIFTT, IP Group",other,Fortune Term Sheet,2025-04-03
Butlr,$7M,Series unspecified,AI-powered thermal sensors,https://www.finanznachrichten.de/nachrichten-2025-01/64407097-butlr-technologies-inc-ricoh-and-butlr-forms-capital-and-business-alliance-through-the-ricoh-innovation-fund-200.htm,"Ricoh, Wistron, Taiwan Global Angels",other,Fortune Term Sheet,2025-04-03
GRACE,$6.4M,Seed,Luxury goods protection,https://loyaltyinnovators.com/index.php/2025/04/03/grace-raises-e5-9-million-seed-to-offer-insurance-to-luxury-goods/,"FinTechCollective, Speedinvest, FirstMinuteCapital, Purple, Kima, BPI France, and angel investors",other,Fortune Term Sheet,2025-04-03
TrialKit,$4.3M,Seed,AI-powered legal discovery,https://www.leadsontrees.com/news/legal-tech-innovator-trialkit-secures-4.69m-in-seed-funding-to-revolutionize-discovery-data-management,"UpWest, 97212 Ventures, Kaedan Capital, NYU Law's Entrepreneurship & Venture Capital Program",other,Fortune Term Sheet,2025-04-03
Acuity Behavioral Health,$1.5M,Seed,Behavioral health intelligence,https://finance.yahoo.com/news/therapy-iq-secures-1-5-140000459.html,"Valor Ventures, others",Healthcare,Fortune Term Sheet,2025-04-03
Northwind Climate,$1.1M,Pre-Seed,climate economy BI,https://northwindclimate.com/,"Tom Steyer, Deval Patrick, Alexander Hoffmann, and others",other,Fortune Term Sheet,2025-04-03
Mandos,$1M,Seed,mens health platform,https://www.finsmes.com/2025/04/mandos-raises-over-1m-in-funding.html,"Render Capital, Stone Mountain Ventures",other,Fortune Term Sheet,2025-04-03
Sturdy.ai,$6M,Seed,customer intelligence,https://vcnewsdaily.com/sturdy.ai/venture-capital-funding/gpnrmrmqxt,"Voyager Capital, Fortson VC, Grotech Ventures",fintech,VC News Daily,2025-04-03
orthobrain,$7.5M,Growth Financing,Orthodontic dental systems,https://vcnewsdaily.com/orthobrain/venture-capital-funding/lkcpdszfld,"CareCapital, JumpStart Ventures, JobsOhio",healthcare,VC News Daily,2025-04-03
Airvet Grabs $11M Series B-2 Round,$11M,Series B,pet telehealth,https://vcnewsdaily.com/airvet/venture-capital-funding/wckwgbrqjn,"HighlandX, HIPstr (early-stage investment arm of HighPost Capital)",healthcare,VC News Daily,2025-04-03
Insilico Medicine,$110,Series E,AI-driven drug discovery,https://vcnewsdaily.com/insilico-medicine/venture-capital-funding/lxgrrtnbss,"Value Partners Group, industry- and technology-focused new investors, global existing backers",healthcare,VC News Daily,2025-04-03
Gable,$20M,Series A,data management platform,https://vcnewsdaily.com/gable-ai/venture-capital-funding/djvdtlyddp,"Crane Venture Partners, Zetta Venture Partners, Databricks Ventures, B Capital, Capital One Ventures, In-Q-Tel (IQT), Barr Moses, and Tristan Handy",fintech,VC News Daily,2025-04-03
OpenAI,$40,Series,Artificial intelligence,https://vcnewsdaily.com/openai/venture-capital-funding/sjtlqxzjwr,"SoftBank, Microsoft, Coatue, Altimeter and Thrive",other,VC News Daily,2025-04-03
Omaha Productions,$80M,Minority Investment,media production,https://vcnewsdaily.com/omaha-productions/venture-capital-funding/qjpvxngjsh,Patrick Whitesell and Silver Lake,other,VC News Daily,2025-04-03
Retym,$75,Series D,AI Infrastructure,https://vcnewsdaily.com/retym/venture-capital-funding/njqqdtxgbq,"Spark Capital, Kleiner Perkins, Mayfield, and Fidelity Investments",other,VC News Daily,2025-04-03
Arbor Biotechnologies,$73.9,Series C,gene editing therapeutics,https://vcnewsdaily.com/arbor-biotechnologies/venture-capital-funding/yhmffrjplq,"ARCH Venture Partners, TCGX, QIA, Partners Investment, Revelation Partners, Kerna Ventures, abrdn Inc., Ally Bridge Group, Arrowmark Partners, Deep Track Capital, Piper Heartland Healthcare Capital, Surveyor Capital, Temasek, T. Rowe Price Associates and Vertex Pharmaceuticals Incorporated",healthcare,VC News Daily,2025-04-03
ReliaQuest,$500M,Unspecified,AI-powered security,https://www.scworld.com/brief/over-500m-obtained-by-reliaquest-in-new-funding-round,"EQT, KKR, FTV Capital, Ten Eleven Ventures, Finback Investment Partners",other,Fortune Term Sheet,2025-04-03
Playback,$22M,Series A,Sports live-streaming,https://www.sportspro.com/news/playback-nba-alexis-ohanian-investment-live-streaming-mlb-partnership-march-2025/,"Seven Seven Six, Khosla Ventures, NBA Investments, Soma Capital",other,Fortune Term Sheet,2025-04-03
Venteur,$20M,Series A,health benefits provider,https://www.fiercehealthcare.com/finance/morgan-health-joins-20m-series-ichra-company-venteur,"Informed Ventures, American Family Ventures, Morgan Health, Catalyst by Wellstar, Ingeborg Investments, Plug and Play, Techstars, Revelry Venture Partners, and Houghton Street Ventures",healthcare,Fortune Term Sheet,2025-04-03
Airvet,$11M,Series B-2,Pet telehealth,https://www.finsmes.com/2025/04/airvet-raises-11m-in-series-b-2-funding.html,"HighlandX, HIPstr",healthcare,Fortune Term Sheet,2025-04-03
Atomic,$10M,Undisclosed,Financial connectivity,https://www.businesswire.com/news/home/20250401988769/en/Atomic-Raises-%2410-Million-in-Strategic-Round-from-Capital-One-Ventures-Citi-Ventures-and-F.N.B.-Corporation,"Capital One Ventures, Citi Ventures, and F.N.B. Corporation",fintech,Fortune Term Sheet,2025-04-03
Incentify,$9.5M,Series A,AI-powered incentives platform,https://www.forbes.com/sites/josipamajic/2025/04/03/incentify-secures-95-million-series-a-funding-to-revolutionize-tax-credit-and-incentive-management/,"Innovent Capital Group, Ryan LLC, Gary Gilbert",other,Fortune Term Sheet,2025-04-03
Limitless Travel,$8.4M,Series A,disability-friendly travel,https://techround.co.uk/news/limitless-travel-angus-drummond-announces-seed-funding-raise/,"Beringea, Active Partners, Social Impact Enterprises, Adjuvo, Miroma Ventures, Nigel Wray",other,Fortune Term Sheet,2025-04-03
Gierd,$8M,Series Unknown,B2B ecommerce sales,https://www.msn.com/en-us/money/companies/idaho-startup-gierd-lands-8m-to-help-brands-bolster-e-commerce-business-on-marketplaces/ar-AA1C5jW8,"Nyca Partners, Fortson VC, Kick Start",commerce,Fortune Term Sheet,2025-04-03
Deacon Health,$7M,Seed,Specialty care management,https://www.morningstar.com/news/business-wire/20250402350727/deacon-health-launches-to-bring-tech-enabled-care-coordination-services-to-specialty-care,"Herb Fritch, Larry Cash, David Vandewater, and others",healthcare,Fortune Term Sheet,2025-04-03
FurtherAI,$5M,Series Unknown,AI-powered insurance,https://www.forbes.com/sites/ericsiegel/2025/01/06/3-predictions-for-predictive-ai-in-2025/,"Nexus Venture Partners, Pioneer AI Fund, South Park Commons, Y Combinator",other,Fortune Term Sheet,2025-04-03
Vallor,$4M,Seed,AI procurement contracts,https://siliconangle.com/2025/04/02/vallor-raises-4m-advance-ai-automation-enterprise-procurement/,"Dynamo Ventures, Bloomberg Beta, Liquid 2 Ventures, El Cap Ventures, Rock Yard Ventures, and angel investors.",other,Fortune Term Sheet,2025-04-03
Sourcetable Bags $4.3 Million,$4.3,Seed,AI-powered data analysis,https://vcnewsdaily.com/sourcetable/venture-capital-funding/zhfnshvvmb,"Bee Partners, Julien Chaumond (Hugging Face co-founder), Preston-Werner Ventures (GitHub co-founder), Roger Bamford (Distinguished Architect at MongoDB), and James Beshara (Magic Mind co-founder)",Other,VC News Daily,2025-04-03
LXE Hearing Receives $100M Investment,$100M,Investment,hearing health,https://vcnewsdaily.com/lxe-hearing/venture-capital-funding/npmdwqhclt,Patient Square Capital,healthcare,VC News Daily,2025-04-03
Supira Medical Bags $120M Series E,$120M,Series E,percutaneous ventricular assist devices,https://vcnewsdaily.com/supira-medical/venture-capital-funding/wzmhbgqbpr,"Novo Holdings, Qatar Investment Authority, Cormorant Asset Management, The Capital Partnership, 415 Capital, AMED Ventures, PA MedTech VC fund, and Unorthodox Ventures",healthcare,VC News Daily,2025-04-03
Temporal Technologies,$146M,Series C,Workflow orchestration,https://vcnewsdaily.com/temporal-technologies/venture-capital-funding/xmtxlwvgms,"Tiger Global, StepStone Group, Amplify Partners, Index Ventures, MongoDB Ventures, Sequoia Capital, Conversion Capital, Hanwha Next Generation Opportunity Fund, and 137 Ventures",other,VC News Daily,2025-04-03
Persefoni,$23,Series C,sustainability management,https://vcnewsdaily.com/persefoni/venture-capital-funding/yhsrzsccfl,"a leading European luxury fashion house, TPG Rise, Rice Investment Group, Clearvision Ventures, NGP Energy Technology Partners, Prelude Ventures, and Co-Founder & CEO Kentaro Kawamori",fintech,VC News Daily,2025-04-03
Fleetio,$450,Series D,fleet optimization,https://vcnewsdaily.com/fleetio/venture-capital-funding/kmwqwqhknp,Elephant and Growth Equity at Goldman Sachs Alternatives,fintech,VC News Daily,2025-04-03
LightSource,$33M,Series A,AI-powered procurement,https://www.finsmes.com/2025/04/lightsource-raises-33m-in-funding.html,"Bain Capital Ventures, Lightspeed Venture Partners, J2 Ventures",other,Fortune Term Sheet,2025-04-03
Chef Robotics,$20.6M,Series A,AI-powered meal assembly,https://www.nbcchicago.com/news/business/money-report/chef-robotics-raises-20-6-million-to-continue-building-ai-robot-arms/3710203/,"Avataar Ventures, Construct Capital, Bloomberg Beta, Promus Ventures",other,Fortune Term Sheet,2025-04-03
Phlux Technology,$11.6M,Series A,Infrared sensor company,https://www.reuters.com/technology/artificial-intelligence/openai-closes-66-billion-funding-haul-valuation-157-billion-with-investment-2024-10-02/,"BGF, Octopus Ventures, Northern Gritstone, Foresight",other,Fortune Term Sheet,2025-04-03
Ribbon,$8M,Series Unknown,AI-powered recruitment,https://www.finsmes.com/2025/03/ribbon-raises-8m-in-funding.html,"Radical Ventures, Social Leverage, Cadenza Ventures, GD1",other,Fortune Term Sheet,2025-04-03
Cambrian,$5.9M,Seed,financial AI agent training,https://techstartups.com/2025/03/31/cambrian-raises-5-9m-seed-round-from-a16z-csx-to-power-ai-agents-with-verifiable-financial-data/,"a16z's Crypto Startup Accelerator, Blockchain Builders, angel investors",fintech,Fortune Term Sheet,2025-04-03
ControlTheory,$5M,Seed,observability control platform,https://www.finsmes.com/2025/04/controltheory-raises-5m-seed-funding.html,Silverton Partners,other,Fortune Term Sheet,2025-04-03
Sohar Health Banks $3.8M Seed Round,$3.8M,Seed,health insurance verification,https://vcnewsdaily.com/sohar-health/venture-capital-funding/yvdhfdnhbk,"Kindred Capital, Y Combinator, Rebel Fund, and Concept Ventures",healthcare,VC News Daily,2025-04-03
Lomond Therapeutics,$20,private placement,hematological malignancies treatment,https://vcnewsdaily.com/lomond-therapeutics/venture-capital-funding/jgkcldzjvy,Yosemite Capital and QIA Investments,healthcare,VC News Daily,2025-04-03
Kay.ai,$3,Series Unknown,insurance brokerage,https://vcnewsdaily.com/kay.ai/venture-capital-funding/tqcxlyshbw,"Wing VC, South Park Commons, 101 Weston Labs, several angel investors",fintech,VC News Daily,2025-04-03
Charm Security Receives $8M Seed Round,$8M,Seed,cybersecurity,https://vcnewsdaily.com/charm-security/venture-capital-funding/wyyrxdyqzg,Team8,fintech,VC News Daily,2025-04-03
Plural Grabs $6M Seed Financing Round,$6M,Seed,Kubernetes management,https://vcnewsdaily.com/plural/venture-capital-funding/bksxhftvjv,"Primary Venture Partners, Capital One Ventures, Company Ventures",Fintech,VC News Daily,2025-04-03
MemryX,$44M,Series B,edge AI processing,https://vcnewsdaily.com/memryx/venture-capital-funding/vlxxflrwxr,new and existing investors,other,VC News Daily,2025-04-03
GridPoint,$45M,Financing round,Commercial building decarbonization,https://vcnewsdaily.com/gridpoint/venture-capital-funding/dpnpcptqwz,"Marunouchi Innovation Partners (MIP), Goldman Sachs, I Squared Capital, Shell Ventures, TOMS Capital, Fortress Investment Group, Olympia Group, and QVT Financial",other,VC News Daily,2025-04-03
Certiverse,$11M,Series A,AI-powered certification,https://techcrunch.com/2025/03/27/certification-platform-certiverse-nabs-11m-series-a-led-by-cherryrock/,"Cherryrock Capital, Chingona Ventures, Hyde Park Venture Partners, Angeles Ventures",other,Fortune Term Sheet,2025-04-03
LTV.ai,$5.2M,Series A,AI-powered email marketing,https://www.businessinsider.com/ltvai-ai-marketing-startup-raises-5m-series-a-pitch-deck-2025-3?op=1,"Bling Capital, Protagonist, Justin Yoshimura, OVO Fund",commerce,Fortune Term Sheet,2025-04-03
Sourcetable,$4.3M,Seed,AI-powered spreadsheets,https://www.forbes.com/sites/charliefink/2025/03/31/sourcetable-launches-ai-spreadsheets-with-43-million-in-new-funding/,"Bee Partners, Julien Chaumond, Preston-Werner Ventures, Roger Bamford, James Beshara",other,Fortune Term Sheet,2025-04-03
