Company,Amount,Funding Round,Vertical,Link,Investors,Category,Source,Date
Protege,$25M,Series A,AI training data,https://vcnewsdaily.com/protege/venture-capital-funding/jpwqflptrv,"Footwork, CRV, Bloomberg Beta, Flex Capital, Shaper Capital, Liquid 2 Ventures",other,VC News Daily,2025-08-14
Drivepoint,$9M,Series A,consumer brand finance,https://vcnewsdaily.com/drivepoint/venture-capital-funding/fnzxnmfcnr,"Vocap Partners, Bling Capital, Vinyl VC, Las Olas Venture Capital, Jefferies' Family Office, Good Friends VC",fintech,VC News Daily,2025-08-14
Mesa,$24M,strategic funding round,homeownership membership,https://vcnewsdaily.com/mesa/venture-capital-funding/pssdwwppgg,"Lowe's, Paramount Residential Mortgage Group, Trinity Capital,  other strategic mortgage lenders and servicers",fintech,VC News Daily,2025-08-14
Celestial AI,$255M,Series C,optical interconnect technology,https://vcnewsdaily.com/celestial-ai/venture-capital-funding/xsgkngsmhs,"VentureTech Alliance, Samsung Catalyst Fund",other,VC News Daily,2025-08-14
Uncle Arnie's,$7.5M,Series A,Cannabis beverages,https://vcnewsdaily.com/uncle-arnie%27s/venture-capital-funding/hxcnjvnvpz,"Mindset Capital, Delta Emerald Ventures, Harry Rubin",other,VC News Daily,2025-08-14
Hyphen,$25M,Series B,Automated foodservice,https://vcnewsdaily.com/hyphen/venture-capital-funding/dnyvwgjggt,CAVA Group,other,VC News Daily,2025-08-14
Titan,$74M,Series Undisclosed,Managed IT services,https://vcnewsdaily.com/titan-ai/venture-capital-funding/ltrnzxnjgx,General Catalyst and other leading investors,fintech,VC News Daily,2025-08-14
Evertune,$15M,Series A,AI marketing platform,https://vcnewsdaily.com/evertune/venture-capital-funding/nvjhcrvqrc,"Felicis Ventures, Sarfraz Maredia (Uber), Jonathan Carson (Antenna), David Azose (OpenAI), Sonia Phene (OpenAI), Joseph Spisak (Meta) and Chip Ransler (UVA), Eniac Ventures, NextView Ventures, and Roger Ehrenberg",other,VC News Daily,2025-08-14
ReprieveCardiovascular,$61M,Series B,decompensated heart failure treatment,,"DeerfieldManagement, ArboretumVentures, LightstoneVentures, SanteVentures, GenesisCapital, and others",healthcare,Fortune Term Sheet,2025-08-14
IsaacHealth,$10.5M,Series A,Brain health & dementia care,,"FlareCapital, Industry Ventures, Black Opal Ventures, Meridian Street Capital, B Capital, PrimetimePartners",healthcare,Fortune Term Sheet,2025-08-14
Thread,$8M,Series Unknown,AI service desk software,,"Integr8dCapital, DavidBellini, Headline, AdamSlutskin, VinceKent",other,Fortune Term Sheet,2025-08-14
Prefer,$4.2M,Series Unknown,Food Technology,,"At One Ventures, ChanceryHillCapital, ForgeVentures",Other,Fortune Term Sheet,2025-08-14
Archestra,$3.3M,Pre-Seed,AI agent connectivity,,"ConceptVentures, Zero Prime Ventures, Celero Ventures, RTP Global",other,Fortune Term Sheet,2025-08-14
Jocasta Neuroscience,$35M,Series A,Neurodegenerative treatments,https://vcnewsdaily.com/jocasta-neuroscience/venture-capital-funding/lvjlydncsy,"True Ventures, Moore Strategic Ventures, SC8 Investments, Glentura, Yagan Family Foundation, and others",healthcare,VC News Daily,2025-08-14
Squint,$40M,Series B,Manufacturing Intelligence Platform,https://vcnewsdaily.com/squint/venture-capital-funding/btlwmyvvwv,"The Westly Group, TCV, Sequoia Capital, Menlo Ventures",other,VC News Daily,2025-08-14
Claros Technologies,$10M,convertible note,PFAS destruction technologies,https://vcnewsdaily.com/claros-technologies/venture-capital-funding/yqddtnmtkr,"Capita3, the University of Minnesota, American Century Private Investments, F. R. Bigelow Foundation, and several new strategic investors",other,VC News Daily,2025-08-14
1Kosmos,$57M,Series B,identity verification,https://vcnewsdaily.com/1kosmos/venture-capital-funding/fnjsxctdkx,"Forgepoint Capital, Origami's Oquirrh Ventures, Craig Abod, Founder and President of Carahsoft, NextEra Energy Ventures, Gula Tech Adventures, and the 1Kosmos management team",fintech,VC News Daily,2025-08-14
Inclined,$8M,Series B,Whole life insurance,https://vcnewsdaily.com/inclined/venture-capital-funding/jyvjrmtjdz,"HSCM Ventures, Northwestern Mutual Future Ventures",fintech,VC News Daily,2025-08-14
Uncle Arnieâ€™s,$7.5M,Series A,THC and hemp beverages,,"Mindset Capital, Delta Emerald Ventures, Harry Rubin",other,F6S Fresh Funding,2025-08-14
HolmesAI,$3M,Seed+,Persona-based AI Agent,,"['Bitrise Capital', 'Waterdrip Capital', 'CGV Fund']",other,F6S Fresh Funding,2025-08-14
Onerway,$10M,Series A+,global payments infrastructure,,"Yunqi, Lanchi Ventures, Eminence Ventures and Enlight Growth Partners",fintech,F6S Fresh Funding,2025-08-14
Qloud Games,$5M,Seed,Multiplayer online gaming,,"BITKRAFT Ventures, GFR Fund, Andreessen Horowitz (a16z), 1UP Fund and Gaingels",other,F6S Fresh Funding,2025-08-14
Refold AI,$6.5M,Series Unknown,AI-powered infrastructure,,"Eniac Ventures, Tidal Ventures, Better Capital, Ahead VC, Karman Ventures, Z21",other,F6S Fresh Funding,2025-08-14
TILKI,$2.2M,Pre-Seed,AI-powered game creation,,"['Twin Path Ventures', 'Atlas AI^VB Fund I (Atlas sgr)', 'XTX Ventures', 'SFC Capital']",other,F6S Fresh Funding,2025-08-14
Inclined Technologies,$8M,Series B,Insurance Cash Value Optimization,,"HSCM Ventures, Northwestern Mutual Future Ventures",other,F6S Fresh Funding,2025-08-14
Liquid,$2.1M,Seed,Real Estate Market,,"SaaSholic, Flourish Ventures, Honey Island by 4UM, Crivo Ventures",other,F6S Fresh Funding,2025-08-14
Tako,$18M,Series Unknown,AI powered payroll,,"Ribbit Capital, Andreessen Horowitz",Fintech,F6S Fresh Funding,2025-08-14
Novig,$18M,Series A,sports prediction market,,"Forerunner, Y Combinator, NFX, Perceptive Ventures, Gaingels",other,F6S Fresh Funding,2025-08-14
BinSentry,$50M,Series C,Agricultural feed supply chains,,Lead Edge Capital,other,F6S Fresh Funding,2025-08-14
Chowdeck,$9M,Series A,on-demand delivery,,"Novastar Ventures, Y Combinator, AAIC Investment, Rebel Fund, GFR Fund, Kaleo, HoaQ, and others",commerce,F6S Fresh Funding,2025-08-14
Swirltex,$1.2M,Seed,Wastewater treatment,,The Central Texas Angel Network (CTAN),other,F6S Fresh Funding,2025-08-14
Xpand,$6M,Series Unknown,Autonomous Retail Stores,,"Ibex Investors, Emerge",commerce,F6S Fresh Funding,2025-08-14
Edumentors,$2M,Seed,Online tutoring platform,,"Magna Investment, UK and international angels",Other,F6S Fresh Funding,2025-08-14
Translucent AI,7M,Seed,AI for healthcare finance,,"NEA, Virtue, FPV, Redesign Health",fintech,F6S Fresh Funding,2025-08-14
Alaan,$48M,Series A,AI-powered financial services,,"Peak XV Partners (formerly Sequoia Capital India & SEA), 885 Capital, Y Combinator, 468 Capital, and Pioneer Fund",fintech,F6S Fresh Funding,2025-08-14
Lava Payments,$5.8M,Seed,digital wallet,,"Lerer Hippeau, Harlem Capital, Streamlined Ventures, and Westbound",fintech,F6S Fresh Funding,2025-08-14
OneSkin,$20M,Not specified,Skin longevity brand,,Prelude Growth Partners,Other,F6S Fresh Funding,2025-08-14
WiseBee,$2.5M,Pre-Seed,Cybersecurity platform,,"Frontline Ventures, BrightCap Ventures",other,F6S Fresh Funding,2025-08-14
Flox Robotics,$1M,Seed,wildlife intelligence,,"Unconventional Ventures, Norrsken Accelerate, Almi Invest, E14 Invest, Argand Partners, angel investors",other,F6S Fresh Funding,2025-08-14
Bit2Me,$30M,Series Unknown,digital asset platform,,"Tether Ventures, undisclosed investors",other,F6S Fresh Funding,2025-08-14
Casap,$25M,Series A,Fraud and dispute automation,,"Emergence Capital, Lightspeed Venture Partners, Primary Venture Partners, SoFi",Other,F6S Fresh Funding,2025-08-14
Albi,significant,Series B,restoration management,https://vcnewsdaily.com/albi/venture-capital-funding/zmxpzskfyk,Frontier Growth,other,VC News Daily,2025-08-15
IgniteData,,Series A,clinical trial automation,https://vcnewsdaily.com/ignitedata/venture-capital-funding/mkxzczrmmc,"FCA Venture Partners, SpringTide, Oncology Ventures",healthcare,VC News Daily,2025-08-15
Topline Pro,$27M,Series B,home service,https://vcnewsdaily.com/topline-pro/venture-capital-funding/wbdqrszpfd,"Northzone (Molly Alter), Tactile Ventures, Industry Ventures, Forerunner Ventures, Bonfire Ventures, TMV, Flybridge, and BBG Ventures",other,VC News Daily,2025-08-15
Cache,$12.5M,Series A,wealth management,https://vcnewsdaily.com/cache/venture-capital-funding/cgfkyqqfjn,"First Round Capital, solo investors from across technology and finance",fintech,VC News Daily,2025-08-15
XOPS,$40M,Other,Autonomous IT operations,https://vcnewsdaily.com/xops/venture-capital-funding/bdjfjqfztv,"Activant Capital, FPV Ventures",Other,VC News Daily,2025-08-15
Mesh,over $130 million,Additional Investments,crypto payments,https://vcnewsdaily.com/mesh/venture-capital-funding/rfpwjbmrpk,"PayPal Ventures, Coinbase Ventures, Uphold, Mirana Ventures, SBI Investment, Overlook Ventures, Kingsway Capital, Moderne Ventures and CE-Ventures",fintech,VC News Daily,2025-08-15
Citizen Health,$30M,Series A,rare disease care,https://vcnewsdaily.com/citizen-health/venture-capital-funding/rsycjrhkmg,"8VC, Transformation Capital, Headline",healthcare,VC News Daily,2025-08-15
LawPro.ai,not specified,Seed,legal tech,https://vcnewsdaily.com/lawpro.ai/venture-capital-funding/fckzxgmbbk,Scopus Ventures,fintech,VC News Daily,2025-08-15
Plancraft,$44.2M,Series B,AI for tradespeople,,"Headline, Creandum, HTGF, xdeck",other,Fortune Term Sheet,2025-08-15
VibeCode,$9.4M,Series Unknown,App Development Platform,,"776Fund, LongJourneyVentures, Neo, FirstHarmonic, AforeCapital, and others",other,Fortune Term Sheet,2025-08-15
Waterly,$4M,Series A,Water data collection software,,"Burnt Island Ventures, Emerald Technology Ventures",other,Fortune Term Sheet,2025-08-15
BetterMedicine,$1.16M,Pre-Seed,AI-powered healthcare,,"SoulmatesVentures, SpecialistVC, UTVentures, angel investors",healthcare,Fortune Term Sheet,2025-08-15
Cohere,$500M,Series,Enterprise AI,,"Radical Ventures, Inovia Capital, AMD Ventures, Nvidia, Salesforce Ventures",other,F6S Fresh Funding,2025-08-15
OneCrew,$7.5M,Series A,paving contractor platform,,"Stage 2 Capital, Entourage, Bienville Capital",other,F6S Fresh Funding,2025-08-15
Create,$8.5M,Series A,AI-powered agency,,"Bessemer Venture Partners, Tobi LÃ¼tke",other,F6S Fresh Funding,2025-08-15
Studio Atelico,5M,Seed,AI-first gaming,,"Air Street Capital, Chris RÃ©, Thomas Wolf, Alex Ratner",other,F6S Fresh Funding,2025-08-15
Continua,$8M,Seed,social AI conversations,,"GV, Bessemer Venture Partners, Jeff Dean, Adam Ghetti, Eoghan McCabe, Josh Reznick, Peter Mattis, Spencer Kimball, Daniel Loreto, Ben Sigelman, Dor Levi, Zach Lloyd, Eyal Manor, Lauryn Motamedi, Des Traynor, Dan Shipper, and more",other,F6S Fresh Funding,2025-08-15
FieldPulse,$50,Series C,field service management,https://vcnewsdaily.com/fieldpulse/venture-capital-funding/wtjnjrtnbz,"Fulcrum Equity Partners, Catalyst Investors",other,VC News Daily,2025-08-19
Reprieve Cardiovascular Banks $61M in Series B,$61M,Series B,decongestion management therapy,https://vcnewsdaily.com/reprieve-cardiovascular/venture-capital-funding/xrxzzlvmrs,"Deerfield Management, Arboretum Ventures, Lightstone Ventures, Sante Ventures, Genesis Capital, Rex Health Ventures, Cadence Capital, and an undisclosed strategic investor",healthcare,VC News Daily,2025-08-19
Medallion Obtains $43 Million,$43,Unspecified,provider network infrastructure,https://vcnewsdaily.com/medallion/venture-capital-funding/nylrymkmfp,"Acrew Capital, Washington Harbour Partners, Sequoia Capital, GV, Spark Capital, NFDG",fintech,VC News Daily,2025-08-19
Vulcan Elements,$65,Series A,rare earth magnet supply chain,https://vcnewsdaily.com/vulcan-elements/venture-capital-funding/yjkxxsqgxr,"Altimeter Capital, One Investment Management",other,VC News Daily,2025-08-19
TOTE.AI,$22.6,Series,fuel and convenience,https://vcnewsdaily.com/tote.ai/venture-capital-funding/wvpxzclscf,"Cota Capital, Storm Ventures, Cervin Ventures",other,VC News Daily,2025-08-19
Polestar Analytics,$12.5M,growth capital,data analytics & planning,https://vcnewsdaily.com/polestar-analytics/venture-capital-funding/nypkvnlnft,..,fintech,VC News Daily,2025-08-19
Keychain Pulls In $30M Series B Funding Round,$30M,Series B,CPG manufacturing,https://vcnewsdaily.com/keychain/venture-capital-funding/thpfshhbrp,"Wellington Management, BoxGroup, Lightspeed Venture Partners, SV Angel, General Mills, The Hershey Company, Schreiber Foods, and Rich's Food",fintech,VC News Daily,2025-08-19
SetPoint Medical Bags $140M in Series C and D,$140M,Series C,digital therapeutics,https://vcnewsdaily.com/setpoint-medical/venture-capital-funding/dmymcxrmzf,"Elevage Medical Technologies, Ally Bridge Group, Northwell Health, SPRIG Equity, Abbott, Boston Scientific, and an undisclosed strategic investor",healthcare,VC News Daily,2025-08-19
IVIX,$60,Series B,financial crime prevention,https://vcnewsdaily.com/ivix/venture-capital-funding/hpknznpsvg,"O.G. Venture Partners (OGVP), Insight Partners, Citi Ventures, Team8, Disruptive AI, Cardumen Capital, and Cerca",fintech,VC News Daily,2025-08-19
Inciador,$6M,Seed,payment solutions,,"ValorCapital, big_bets, AlterGlobal, Arctyus, NorteVentures",fintech,Fortune Term Sheet,2025-08-19
Paradigm,$5M,Seed,AI-powered spreadsheets,,GeneralCatalyst,other,Fortune Term Sheet,2025-08-19
Innerworks,$4M,Seed,cybersecurity,,"AlbionVC, DigitalCurrencyGroup, FoundersCapital, FirestreakVentures, NVTBLVentures, Metaversal Ventures",other,Fortune Term Sheet,2025-08-19
July AI,$1.04M,Pre-Seed,AI training for professionals,,"BasisSet, Liquid 2Ventures, Night Capital, SV Angel, and others",other,Fortune Term Sheet,2025-08-19
Sola,$17.5M,Series A,Robotic Process Automation (RPA),,"Andreessen Horowitz, Conviction, Y Combinator",other,F6S Fresh Funding,2025-08-19
SpinLaunch,$30M,Series Unknown,Space technology,,"ATW Partners, Kongsberg Defence and Aerospace",other,F6S Fresh Funding,2025-08-19
Medallion,$43M,Series Unknown,AI-powered provider networks,,"Acrew Capital, Washington Harbour Partners, Sequoia Capital, GV, Spark Capital, NFDG, and others",healthcare,F6S Fresh Funding,2025-08-19
Tote.ai,$22.6M,Series Unknown,Fuel & Convenience Retail,,"Cota Capital, Storm Ventures, Cervin Ventures",commerce,F6S Fresh Funding,2025-08-19
Riva Money,$3M,Pre-Seed,Global payments fintech,,"['Project A', 'Angels from Revolut, Ebury, Monzo, and J.P. Morgan']",fintech,F6S Fresh Funding,2025-08-19
CourseRev.ai,,Seed,AI for golf,https://vcnewsdaily.com/courserev.ai/venture-capital-funding/gkzbdhlmbb,The Walden Golf Group,other,VC News Daily,2025-08-19
Midas,$80M,Series B,investment platform,,"QED Investors, International Finance Corporation (IFC), HSG (formerly Sequoia China), QuantumLight, Spice Expeditions LP, and George Rzepecki",fintech,F6S Fresh Funding,2025-08-20
Keychain,$30M,Series B,consumer packaged goods,,"Wellington Management, BoxGroup",other,F6S Fresh Funding,2025-08-20
Firecrawl,$14.5M,Series A,web data generation,,"Nexus Venture Partners, Y Combinator, Tobias LÃ¼tke, angel investors",other,F6S Fresh Funding,2025-08-20
Zipline AI,$7M,Seed,AI product development,,"Wing VC, Stripe, Box Group, Exceptional Capital",other,F6S Fresh Funding,2025-08-20
Functionize,$41M,Series B,Software testing automation,,"Mumford Investments, LHH Investments, Canvas Ventures, Wipro Ventures",other,F6S Fresh Funding,2025-08-20
Nullspace,$2.5M,Seed,electromagnetic simulation software,,"Fathom Fund, Golden Seeds LLC, and other strategic angel investors",other,F6S Fresh Funding,2025-08-20
TensorZero,$7.3M,Seed,Open-source LLM applications,,"FirstMark, Bessemer Venture Partners, Bedrock, DRW, Coalition, angel investors",other,F6S Fresh Funding,2025-08-20
Three Space Lab,$3M,Seed,VR real estate visualization,,Arminius Verwaltung,other,F6S Fresh Funding,2025-08-20
Casca,$29M,Series A,AI-powered loan origination,,"Live Oak Bank, Huntington National Bank, Bankwell, Y Combinator, Peterson Ventures, Alliance Funding Group",fintech,F6S Fresh Funding,2025-08-20
Eight Sleep,$100M,Series Unknown,Sleep Fitness Company,,"HSG, Valor Equity Partners, Atreides, Founders Fund, Y Combinator, Charles Leclerc, Zak Brown",Other,F6S Fresh Funding,2025-08-20
ShiftUp,$3M,Seed,AI-powered sales intelligence,,"Phil Reed, former VCs, sales executives, CFOs, and CTOs from Fortune 500 companies",other,F6S Fresh Funding,2025-08-20
BetterPic,$2.5M,Seed,AI imaging,,"MOC Capital, Shilling VC, Louis Jonckheere, Matthias Geeroms, Joris Van Der Gucht, Severine Nijs",other,F6S Fresh Funding,2025-08-20
Convoke,$8.6M,Seed,biopharma software,https://vcnewsdaily.com/convoke/venture-capital-funding/vsjqshzmqv,"Kleiner Perkins, Dimension Capital, ACME, Comma Capital, Liquid2, Not Boring Capital, Audacious, Lux Capital, Qasar Younis, Erik Torenberg",healthcare,VC News Daily,2025-08-20
Basic Capital Bags $25M Series A,$25M,Series A,retirement investing,https://vcnewsdaily.com/basic-capital/venture-capital-funding/rqbdmwmvdm,"Forerunner, Lux Capital, SV Angel, Box Group, Henry Kravis, HOF Capital, Inspired Capital",fintech,VC News Daily,2025-08-20
Ohai.ai,,Series A,AI-powered family assistant,https://vcnewsdaily.com/ohai.ai/venture-capital-funding/wnxtdxyxrh,"Muse Capital, Wisdom Ventures, Olivia Munn, Monique and Melvin Rodriguez, Mindy Kaling, Abby Wambach, Sarah Harden, Hannah Bronfman, Jenny Mollen, Lavinia Errico, Abby Miller Levy, NEA, Eniac Ventures, Bright Ventures, LifeX Ventures, Amy Griffin of G9 Ventures",other,VC News Daily,2025-08-20
Kasa,$40M,growth investment,hospitality management,https://vcnewsdaily.com/kasa-living/venture-capital-funding/jplhjbmnwd,SLW,other,VC News Daily,2025-08-20
Yourway Learning,$9M,Equity,AI-powered K-12 education,https://vcnewsdaily.com/yourway-learning/venture-capital-funding/bpcyghhkrr,leading EdTech and growth-stage investors,other,VC News Daily,2025-08-20
Zed Industries,$32M,Series B,open-source code editor,https://vcnewsdaily.com/zed-industries/venture-capital-funding/fxmfmzzhyl,Sequoia Capital,other,VC News Daily,2025-08-21
Seemplicity,$50M,Series B,exposure action platform,https://vcnewsdaily.com/seemplicity/venture-capital-funding/zpnksbbryf,"Sienna Venture Capital, Essentia Venture Capital, Glilot Capital Partners, NTTVC and S Capital",other,VC News Daily,2025-08-21
EliseAI,$250M,Series E,healthcare automation,https://vcnewsdaily.com/eliseai/venture-capital-funding/dwxjnnknwf,"Andreessen Horowitz (a16z), Bessemer Venture Partners, Sapphire Ventures, Navitas Capital",healthcare,VC News Daily,2025-08-21
Cascala Health,$8.6,Seed,post-acute care,https://vcnewsdaily.com/cascala-health/venture-capital-funding/nkdvcwxsmm,"Flare Capital Partners, Eniac Ventures, Omega Healthcare Investors (NYSE: OHI), Ziegler Link-age Fund, Tau Ventures, and Digital Health Venture Partners",healthcare,VC News Daily,2025-08-21
Upstage,$45M,Series B,enterprise-grade AI,https://vcnewsdaily.com/upstage/venture-capital-funding/mscwfvsjhp,"Korea Development Bank (KDB), Amazon, and AMD",fintech,VC News Daily,2025-08-21
Sonara,not specified,strategic investment,methadone treatment,https://vcnewsdaily.com/sonara/venture-capital-funding/ckfmzkchyj,"Acumen America, Sorenson Impact Foundation, Boomerang Ventures, and First Trust Capital Partners",healthcare,VC News Daily,2025-08-21
SRE.ai,$7.2,Seed,AI-native DevOps,https://vcnewsdaily.com/sre.ai/venture-capital-funding/xtcfjrjtmq,Salesforce Ventures and Crane Venture Partners,other,VC News Daily,2025-08-21
Overhaul,$105,Series C,supply chain risk management,https://vcnewsdaily.com/overhaul/venture-capital-funding/jjpdsbqtyv,"Springcoast Partners, Edison Partners",other,VC News Daily,2025-08-21
Garage,$13.5M,Series A,essential equipment marketplace,https://vcnewsdaily.com/garage/venture-capital-funding/nhnkphgqtd,"Infinity Ventures, Y Combinator, Initialized Capital, Benchstrength, Wayfinder Ventures, and FJ Labs",commerce,VC News Daily,2025-08-21
Lambda,$275M,Credit Facility,Superintelligence Cloud,,"J.P. Morgan, Citi, MUFG, CrÃ©dit Agricole",other,F6S Fresh Funding,2025-08-21
TinyFish,$47M,Series A,Web agent infrastructure,,"ICONIQ, USVP, Mango Capital, MongoDB Ventures, ASG, Sandberg Bernthal Venture Partners",other,F6S Fresh Funding,2025-08-21
Cointel,$7.4M,Series Unpecified,Crypto Education & Trading,,"Avalanche, Sugafam Inc. and others",Fintech,F6S Fresh Funding,2025-08-21
Overhaul,$105M,Series C,supply chain risk management,,"Springcoast Partners, Edison Partners",commerce,F6S Fresh Funding,2025-08-21
Bluefish,20M,Series A,AI marketing platform,,"NEA, Salesforce Ventures, Crane Venture Partners, Swift Ventures, Bloomberg Beta",other,F6S Fresh Funding,2025-08-21
Cascala Health,$8.6M,Seed,Healthcare Technology,,"Flare Capital Partners, Eniac Ventures, Omega Healthcare Investors, Ziegler Link-age Fund, Tau Ventures, Digital Health Venture Partners",healthcare,F6S Fresh Funding,2025-08-21
"Iantrek, Inc.",$42M,Series C,bio-interventional ophthalmic surgery,,"U.S. Venture Partners (USVP), aMoon Fund, Visionary Ventures, Sectoral Asset Management, Radius Special Situations Fund, and Civilization Ventures",healthcare,F6S Fresh Funding,2025-08-21
LoftDynamics,$24M,Series B,virtual reality flight training,,"TheFriedkinGroup, AlaskaAirlines, SkyDayton, CraftVentures, UP.Partners",other,Fortune Term Sheet,2025-08-21
DevelopHealth,$14.3M,Series A,Healthcare benefits verification,,"WingVentureCapital, AforeCapital, JVentures, South Park Commons",healthcare,Fortune Term Sheet,2025-08-21
Phoebe,$17M,Seed,Data issue diagnosis,,GoogleVentures and CherryVentures,other,Fortune Term Sheet,2025-08-21
Definite,$10M,Seed,AI-native data platform,,"Costanoa, AcrewCapital, angel investors",other,Fortune Term Sheet,2025-08-21
Legion,$5M,Seed,Crypto fundraising,,"VanEck, Brevan Howard Digital, Kraken, CoinbaseVentures, GSR, Crypto.com Capital, cyber-Fund, BitscaleCapital, Blockchain Builders Fund, and Systemic",Fintech,Fortune Term Sheet,2025-08-21
Nuro,$203M,Series E,self-driving technology,,"Uber, BaillieGifford, IcehouseVentures, Kindred Ventures, NVIDIA, Pledge Ventures",other,Fortune Term Sheet,2025-08-22
MethodAI,$20M,Series A,Surgical navigation technology,,"A private family office, ClevelandClinic, and JobsOhio Growth Capital Fund",healthcare,Fortune Term Sheet,2025-08-22
Irys,$10M,Series A,datachain technology,,"CoinFund, Hypersphere, TykheVentures, VarrockVentures, Breed VC, EchoGroup, AmberGroup, and WAGMIVentures",other,Fortune Term Sheet,2025-08-22
Agenda Hero,$5.6M,Series A,AI-powered calendaring,,"Upfront Ventures, Precursor Ventures, K9 Ventures",other,Fortune Term Sheet,2025-08-22
Wisdom Grabs $21N Series A Round,$21,Series A,dental insurance billing,https://vcnewsdaily.com/wisdom/venture-capital-funding/wwjcrtdlbh,"Permanent Capital Ventures (PCV), Aquiline, Juxtapose",fintech,VC News Daily,2025-08-25
KROMATID,$8M,Series C,gene & cell therapy,https://vcnewsdaily.com/kromatid/venture-capital-funding/pdgrpynpcx,"BroadOak Capital Partners, existing and new strategic investors",healthcare,VC News Daily,2025-08-25
Therm Solutions,$3.6M,Series A,carbon offset project development,https://vcnewsdaily.com/therm-solutions/venture-capital-funding/trmwlmsmmn,the same private investors who funded its seed round in 2021,other,VC News Daily,2025-08-25
Relcu,not disclosed,not disclosed,financial services,https://vcnewsdaily.com/relcu/venture-capital-funding/gllvsspnjy,"Menlo Ventures, Detroit Venture Partners, Clocktower Ventures, MUFG Innovation Partners, Commerce Ventures, and Valley Ventures",fintech,VC News Daily,2025-08-25
Method AI Receives $20M Series A Round,$20M,Series A,surgical image guidance,https://vcnewsdaily.com/method-ai/venture-capital-funding/vcszbvwsnk,"private family office, Cleveland Clinic, JobsOhio Growth Capital Fund",healthcare,VC News Daily,2025-08-25
Ontic,$230M,Series C,Connected Security Intelligence,https://vcnewsdaily.com/ontic/venture-capital-funding/tfqjfvpfnx,"KKR, JMI Equity, Silverton Partners, Ridge Ventures and Ten Eleven Ventures",other,VC News Daily,2025-08-25
Bluefish,$20M,Series A,AI marketing platform,https://vcnewsdaily.com/bluefish/venture-capital-funding/dnwgpcvwfd,"NEA, Salesforce Ventures, Crane Venture Partners, Swift Ventures, and Bloomberg Beta",fintech,VC News Daily,2025-08-25
SynergySuite Snags $12M Funding Round,$12M,Series A,restaurant operations,https://vcnewsdaily.com/synergysuite/venture-capital-funding/gbwftgwgjq,"Oyster Capital, First Analysis",other,VC News Daily,2025-08-25
Stark,$62M,Series Unknown,Defense tech & space,,"Sequoia, 8VC, Thiel Capital, NATO Innovation Fund, In-Q-Tel, Project A, DÃ¶pfner Capital",other,F6S Fresh Funding,2025-08-25
restor3d,$104m,strategic investment,personalized orthopedic solutions,,"Partners Group, existing shareholders",healthcare,F6S Fresh Funding,2025-08-25
Pylon,$31M,Series B,B2B customer support,,"Bain Capital Ventures, Andreessen Horowitz, General Catalyst, Y Combinator",other,F6S Fresh Funding,2025-08-25
Molecular You,$5M,Series A,"molecular medicine, preventive health",,"Voloridge Health, LLC, Dynamic Leap, and others",healthcare,F6S Fresh Funding,2025-08-25
The Better Meat Co.,$31M,Series A,Plant-based meat alternatives,,"Future Ventures, Resilience Reserve, Epic Ventures, Sigmas Group",Other,F6S Fresh Funding,2025-08-25
Qunova Computing,$10M,Series A,Chemical/Pharmaceutical Software,,"S Ventures, Korea Development Bank, GU Equity Partners, Company K, Quantum Ventures Korea, JB Investment, CKD Venture Capital and Daesung Private Equity",other,F6S Fresh Funding,2025-08-25
Grid Aero,$6M,Seed,Cargo drone technology,,"Calibrate Ventures, Ubiquity Ventures",other,F6S Fresh Funding,2025-08-25
Twin Health,$53M,Series E,Metabolic health,,"Maj Invest, Iconiq, Temasek",healthcare,F6S Fresh Funding,2025-08-25
Agenda Hero,$6.5M,Unknown,AI-powered calendar enhancements,,"Upfront Ventures, Precursor Ventures, K9 Ventures",other,F6S Fresh Funding,2025-08-25
