Company,Amount,Funding Round,Vertical,Link,Investors,Category,Source,Date
Kalshi,$185M,Series C,prediction market,,"Paradigm, Multicoin Capital, Sequoia, Neo, Peng Zhao",other,Fortune Term Sheet,2025-06-27
Halter,$100M,Series D,Cattle ranch technology,,"BOND, NewView, Bessemer Venture Partners, DCVC, Blackbird",other,Fortune Term Sheet,2025-06-27
Neuron23,$96.5M,Series D,Neurological & Immunological Diseases,,"Westlake Village BioPartners, SoftBank Vision Fund 2, Redmile Group, and others",healthcare,Fortune Term Sheet,2025-06-27
Zama,$57M,Series B,blockchain solutions,,"Blockchange Ventures, Pantera Capital",other,Fortune Term Sheet,2025-06-27
Certify,$40M,Series B,Provider data intelligence,,"Transformation Capital, SemperVirens, General Catalyst, Upfront Ventures",other,Fortune Term Sheet,2025-06-27
Metaview,$35M,Series B,AI-powered hiring,,"GV, Plural, Vertex Ventures, Seedcamp",other,Fortune Term Sheet,2025-06-27
Niural,$31M,Series Unknown,AI professional employment,,"Marathon Management Partners, M13, Inspired Capital, Newform Capital",Other,Fortune Term Sheet,2025-06-27
Arine,$30M,Series C,AI-powered medication intelligence,,"Town Hall Ventures, Kaiser Permanente Ventures, and other existing investors",healthcare,Fortune Term Sheet,2025-06-27
Kognitos,$25M,Series B,business operations AI,,"Prosperity7, Khosla Ventures, Wipro Ventures, Engineering Capital, and others",other,Fortune Term Sheet,2025-06-27
Paraform,$20M,Series A,recruiting marketplace,,"Felicis, A*, BOND, DST Global, Liquid 2, and angel investors",other,Fortune Term Sheet,2025-06-27
Synthflow AI,$20M,Series A,Phone call automation,,"Accel, Atlantic Labs, Singular",other,Fortune Term Sheet,2025-06-27
Sibill,$14M,Series A,Financial management solutions,,"Creandum, Keen Venture Partners, angel investors",fintech,Fortune Term Sheet,2025-06-27
Elfie,$12M,Series Unknown,health monitoring app,,"White Star Capital, LifeX Ventures, Integra Partners, FEBE Ventures, Hustle Fund",healthcare,Fortune Term Sheet,2025-06-27
Echandia, $11.1M,Seed,maritime battery systems,,S2G,other,Fortune Term Sheet,2025-06-27
Jarsy,$5M,Pre-Seed,Digital Investment Platform,,"Breyer Capital, Karman Ventures, and angel investors",Fintech,Fortune Term Sheet,2025-06-27
Movemint,$5M,Seed,Athletic events platform,,"Underscore VC, Michael Horvath, Green D Ventures",other,Fortune Term Sheet,2025-06-27
Sitch,$5M,Seed,AI-powered matchmaking,,"M13, a16z SpeedRun",other,Fortune Term Sheet,2025-06-27
Insight Health,$4.6M,Series Unknown,AI agents for clinics,,"Kindred Ventures, 43, RTP, Karman Ventures, and others",healthcare,Fortune Term Sheet,2025-06-27
Antler Bio,$4.3M,Series Unknown,Gene Expression Technology,,"First Thirty Ventures, Endgame Capital, Generation-RE",other,Fortune Term Sheet,2025-06-27
Lux Aeterna,$4M,Pre-Seed,Reusable satellite platforms,,"Space Capital, Dynamo Ventures, Mission One Capital, Alumni Ventures, Service Provider Capital",other,Fortune Term Sheet,2025-06-27
Jobright,$3.2M,Seed,AI-powered job search,,"Translink Capital, HR Tech Investments",other,Fortune Term Sheet,2025-06-27
Waypoint AI,$3.1M,Pre-Seed,AI-powered software,,"42Cap, Dreamcraft Ventures, Berkeley SkyDeck Fund, Lumiere AI Ventures",other,Fortune Term Sheet,2025-06-27
Blank Metal,$3M,Seed,AI-native engineering,,"Rally Ventures, Traction Capital, Pure Play Partners",other,Fortune Term Sheet,2025-06-27
OutSee,$2.5M,Seed,Drug Discovery,,"Ahren Innovation Capital, Kadmos Capital, Empirical Ventures, Panacea Ventures",healthcare,Fortune Term Sheet,2025-06-27
YieldClub,$2.5M,Pre-seed,Crypto savings app,,"Pharsalus, Flex Capital, The House Fund, Superlayer, and angel investors",fintech,Fortune Term Sheet,2025-06-27
Elemental Advanced Materials,$20M,Series Unknown,Sustainable materials,https://vcnewsdaily.com/elemental-advanced-materials/venture-capital-funding/zhgkpbvqmf,Taranis,other,VC News Daily,2025-06-27
Ledgebrook,$65M,Series C,Excess & Surplus Lines Insurance,https://vcnewsdaily.com/ledgebrook/venture-capital-funding/chmrfthlbv,"The Stephens Group, LLC, Duquesne, Brand Foundry, Floating Point, American Family Ventures, and Hummingbird Nomads",fintech,VC News Daily,2025-06-27
AllSpice.io Receives $15M Series A Funding,$15M,Series A,hardware team collaboration,https://vcnewsdaily.com/allspice.io/venture-capital-funding/scfsltszmb,"Rethink Impact, L'ATTITUDE Ventures, GingerBread Capital, DNX Ventures, Root Ventures, Benchstrength, and Flybridge",other,VC News Daily,2025-06-27
Qunnect,$10M,Series A,Quantum networking,https://vcnewsdaily.com/qunnect/venture-capital-funding/cvlrctzfwq,"Airbus Ventures, Cisco Investments, Quantonation",other,VC News Daily,2025-06-27
Claira,$7M,Seed,AI-powered Deal Intelligence,https://vcnewsdaily.com/claira/venture-capital-funding/ygzxlmjvyz,"Barclays, Citi, Reimagine Tech Ventures, Activant Capital, KDX, and OPCO Ventures",fintech,VC News Daily,2025-06-27
Digital Asset,$135M,strategic,blockchain technology,https://vcnewsdaily.com/digital-asset/venture-capital-funding/pqsryllxgn,"DRW Venture Capital, Tradeweb Markets, BNP Paribas, Circle Ventures, Citadel Securities, The Depository Trust & Clearing Corporation (DTCC), Goldman Sachs, IMC, Liberty City Ventures, Optiver, Paxos, Polychain Capital, QCP, Republic Digital, 7RIDGE, and Virtu Financial",fintech,VC News Daily,2025-06-27
Abridge,$300M,Series E,AI-powered healthcare,,"Andreessen Horowitz, Khosla Ventures",healthcare,Fortune Term Sheet,2025-06-27
Finom,$133.6M,Series C,Financial services for SMEs,,"AVP, Headline Growth, General Catalyst, Northzone, Cogito Capital",fintech,Fortune Term Sheet,2025-06-27
ForSight Robotics,$125M,Series B,robotic eye surgery,,"Eclipse, Dr. Fred Moll, Adani Group, Reiya Ventures",healthcare,Fortune Term Sheet,2025-06-27
Spinwheel,$30M,Series A,Consumer Credit Data & Payments,,"F-Prime, QED Investors, Foundation Capital, Fika Ventures",fintech,Fortune Term Sheet,2025-06-27
Wispr,$30M,Series A,AI voice app development,,"Menlo Ventures, Evan Sharp, Henry Ward, NEA, 8VC, Neo, and others",other,Fortune Term Sheet,2025-06-27
Snowcap Compute,$23M,Seed,Superconducting compute,,"Playground Global, Cambium Capital, Vsquared Ventures",other,Fortune Term Sheet,2025-06-27
Eventual,$20M,Series A,multimodal data AI,,"Felicis, M12 Ventures, Citi",other,Fortune Term Sheet,2025-06-27
Delphi,$16M,Series A,AI-powered digital minds,,"Sequoia Capital, Menlo & Anthropicâ€™s Anthology Fund, Proximity Ventures, Crossbeam, and others",other,Fortune Term Sheet,2025-06-27
Quinn,$11M,Seed,AI-powered financial planning,,"Viola Fintech, existing investors",fintech,Fortune Term Sheet,2025-06-27
Skyramp,$10M,Series Unknown,software development tools,,Sequoia Capital,other,Fortune Term Sheet,2025-06-27
Blueprint Finance,$9.5M,Series Unknown,DeFi infrastructure,,"Polychain Capital, Yzi Labs",fintech,Fortune Term Sheet,2025-06-27
Brij,$8M,Series Unknown,AI-powered marketing,,"Bright Pixel Capital, CEAS Investments, Artemis Fund, Red Bike Capital, Lakehouse Ventures, angel investors, and others",other,Fortune Term Sheet,2025-06-27
Empo Health,$7M,Series Unknown,health-monitoring devices,,"Story Ventures, VTC Ventures, Ulu Ventures, SeaX Ventures, Arben Ventures, Gaingels",healthcare,Fortune Term Sheet,2025-06-27
Motorica,$5.8M,Seed,character animation,,"Angular Ventures, Luminar Ventures",other,Fortune Term Sheet,2025-06-27
BackOps AI,$6M,Seed,Supply chain operations,,"Construct Capital, Gradient, 10VC",commerce,Fortune Term Sheet,2025-06-27
Gemist,$6M,Series Unknown,Jewelry Brand Software,,"Entrada Ventures, Artemis Fund, Collide Capital",other,Fortune Term Sheet,2025-06-27
Sifflet Pulls In $18M,$18M,Series,Data observability,https://vcnewsdaily.com/sifflet/venture-capital-funding/mvhrkwxwlp,"EQT Ventures, Mangrove Capital Partners, Capmont Technology",fintech,VC News Daily,2025-06-27
Decagon Obtains $131M Series C Funding,$131M,Series C,Conversational AI for CX,https://vcnewsdaily.com/decagon/venture-capital-funding/vmfcqgcjwp,"Accel, Andreessen Horowitz (Growth Fund), A*, Bain Capital Ventures, BOND, Avra, Forerunner, and Ribbit Capital",Other,VC News Daily,2025-06-27
Commure,$200,Growth,AI-powered healthcare infrastructure,https://vcnewsdaily.com/commure/venture-capital-funding/mhjwmcrttq,General Catalyst's Customer Value Fund (CVF),healthcare,VC News Daily,2025-06-27
Tennr,$101,Series C,health tech,https://vcnewsdaily.com/tennr/venture-capital-funding/wpbltjxntr,"IVP, Google Ventures, Iconiq, Andreessen Horowitz, Lightspeed",fintech,VC News Daily,2025-06-27
Mach Industries,$100,Series B,unmanned defense,https://vcnewsdaily.com/mach-industries/venture-capital-funding/jgcvtgyvwn,"Khosla Ventures, Bedrock, Sequoia Capital",other,VC News Daily,2025-06-27
Profound,$20M,Series A,AI-powered marketing,https://vcnewsdaily.com/profound/venture-capital-funding/qdksktcfjn,"Kleiner Perkins, NVentures, Khosla Ventures, Saga VC, South Park Commons, SV Angel, Guillermo Rauch, Andrew Karam, Jordan Singer, Jordi Hays, David Senra, Kevin Wang",Fintech,VC News Daily,2025-06-27
Decagon,$131M,Series C,Customer Experience AI,,"Accel, Andreessen Horowitz, Avra, Forerunner, Ribbit Capital, A*, Bain Capital Ventures, BOND",other,Fortune Term Sheet,2025-06-27
Botpress,$25M,Series B,AI agent developer,,"FRAMEWORK, Inovia Capital, Deloitte Ventures, HubSpot Ventures, Decibel, and existing investors",other,Fortune Term Sheet,2025-06-27
Veda,$18M,Series Unknown,DeFi vault infrastructure,,"CoinFund, Coinbase Ventures, GSR, Maelstrom, angel investors, and others",fintech,Fortune Term Sheet,2025-06-27
Lyceum,$11.9M,Pre-Seed,AI infrastructure,,"Redalpine, 10x Founders",other,Fortune Term Sheet,2025-06-27
SuperDial,$12M,Series A,Healthcare administration,,"SignalFire, Slow Ventures, Box Group, Scrub Capital",healthcare,Fortune Term Sheet,2025-06-27
Qualytics,$10M,Series A,data quality platform,,"BMW i Ventures, Conductive Ventures, The Hill Fund, Tech Square Ventures, Knoll Ventures, Inner Loop Capital, and others",other,Fortune Term Sheet,2025-06-27
Meridian,$7M,Seed,Private markets deal management,,"645 Ventures, Chaac Ventures, and angel investors",fintech,Fortune Term Sheet,2025-06-27
Moonnox,$2M,Seed,AI-powered professional services,,"M25, Hyde Park Angels, Early Light Ventures, Service Provider Capital",other,Fortune Term Sheet,2025-06-27
PaidHR,$1.8M,Seed,Payroll & HR Management,,"['Accion Venture Lab', 'Zrosk', 'Chui Ventures', 'Zedcrest Capital']",fintech,Fortune Term Sheet,2025-06-27
YieldClub Bags $2.5M Pre-Seed Funding,$2.5M,Seed,Crypto savings platform,https://vcnewsdaily.com/yieldclub/venture-capital-funding/dfklbwbbzz,"Pharsalus, Flex Capital, The House Fund, Superlayer, Kevin Chou, Sam Shank, Charlie Songhurst",fintech,VC News Daily,2025-06-27
Insight M Snares $30M Growth Equity Funding,$30M,Growth Equity,Methane emissions monitoring,https://vcnewsdaily.com/insight-m/venture-capital-funding/wsmhjnxptq,"Morgan Stanley Investment Management (MSIM), DCVC, Climate Investment, Energy Innovation Capital",Other,VC News Daily,2025-06-27
Stackup,$4.2,Seed,crypto operations,https://vcnewsdaily.com/stackup/venture-capital-funding/ckdyylbwqx,"1kx, Y Combinator, Goodwater Capital, Soma Capital, Amino Capital, and Digital Currency Group (DCG)",fintech,VC News Daily,2025-06-27
Actio Biosciences,$66,Series B,precision medicine,https://vcnewsdaily.com/actio-biosciences/venture-capital-funding/sppyrzsyjd,"Regeneron Ventures, Deerfield Management, Canaan, Droia Ventures, Euclidean Capital",healthcare,VC News Daily,2025-06-27
Maven AGI Banks $50M in Series B,$50M,Series B,enterprise AI,https://vcnewsdaily.com/maven-agi/venture-capital-funding/wdpjbkjqcq,"Dell Technologies Capital, Cisco Investments, SE Ventures, Lux Capital, M13, and E14",fintech,VC News Daily,2025-06-27
GeneCentric,$8,Series C,Gene expression analysis,https://vcnewsdaily.com/genecentric/venture-capital-funding/xvgscthzmy,"Hatteras Venture Partners, IAG Capital Partners, Alexandria Venture Investments, and Labcorp",healthcare,VC News Daily,2025-06-27
Pelico,$40M,Series unspecified,Supply chain orchestration,,"General Catalyst, 83North, Serena",commerce,Fortune Term Sheet,2025-06-27
Voliro,$7M,Series A extension,aerial robotics,,"noa, Cherry Ventures and others",other,Fortune Term Sheet,2025-06-27
COVR Global,$2.5M,Seed,AI-powered insurance,,"MTech Capital, B Capital",fintech,Fortune Term Sheet,2025-06-27
Nook,$2.5M,Seed,Crypto savings app,,"Coinbase Ventures, defy.vc, UDHC",fintech,Fortune Term Sheet,2025-06-27
Zenith Energy,$X,Acquisition,Independent power production,,"KKR, Pacific Equity Partners, OPSEU Pension Trust, Foresight Group",other,Fortune Term Sheet,2025-06-27
Argon AI,$5.5M,Seed,AI for life sciences,https://vcnewsdaily.com/argon-ai/venture-capital-funding/yqgpnznmvx,"Crosslink Capital, Wireframe Ventures, Y Combinator, Pioneer Fund",healthcare,VC News Daily,2025-07-03
Circulate Health,$12,Seed,therapeutic plasma exchange,https://vcnewsdaily.com/circulate-health/venture-capital-funding/tzpbzjrsjb,"Khosla Ventures, Seaside Ventures, CSC Ventures",healthcare,VC News Daily,2025-07-03
Emerald AI,$24.5M,Seed,data center efficiency,https://vcnewsdaily.com/emerald-ai/venture-capital-funding/dkyrvtqtss,"Radical Ventures, NVentures (NVIDIA's venture capital arm), AMPLO, CRV, Neotribe, Jeff Dean, John Kerry, Malcolm Turnbull, Fei-Fei Li, John Doerr",other,VC News Daily,2025-07-03
Beep,$52.7M,Series (undisclosed),autonomous mobility solutions,https://vcnewsdaily.com/beep/venture-capital-funding/zjbvjdhzks,Intel Capital and Blue Lagoon Capital,other,VC News Daily,2025-07-03
Deeto,$12.5M,Series A,AI-driven customer insights,https://vcnewsdaily.com/deeto/venture-capital-funding/pwmhcglytw,"Jump Capital, UpWest, TAL Ventures, Mertor, and TAU Ventures",fintech,VC News Daily,2025-07-03
Genesis AI,$105M,Unspecified,Robotics foundation models,https://vcnewsdaily.com/genesis-ai/venture-capital-funding/rrscpqngcr,"Eclipse, Khosla Ventures, Bpifrance, HSG, Eric Schmidt, Xavier Niel",other,VC News Daily,2025-07-03
Adagene,up to $25 million,strategic investment,cancer immunotherapy,https://vcnewsdaily.com/adagene/venture-capital-funding/pnqjwwgvjr,Sanofi,healthcare,VC News Daily,2025-07-03
Wisq,$15M,Series,AI-powered HR,https://vcnewsdaily.com/wisq/venture-capital-funding/pykjqygggz,"Norwest Venture Partners, Shasta Ventures, and True Ventures",other,VC News Daily,2025-07-03
Syntis Bio,$33M,Series A,oral therapies for rare diseases,https://vcnewsdaily.com/syntis-bio/venture-capital-funding/dmqxdxxrwl,"Cerberus Ventures, Mansueto Investments, Woori Venture Partners, Apollo Labs, BOLD Capital Partners, W. R. Berkley Corporation, Safar Partners, Portal Innovations, Colorcon Ventures and Cerity Partners Ventures",healthcare,VC News Daily,2025-07-03
Campfire,$35M,Series A,enterprise planning software,https://vcnewsdaily.com/campfire/venture-capital-funding/ghkxqgmhnr,"Accel, Foundation Capital, Y Combinator, Capital 49, Marten Abrahamsen, Dan Kang, Alex Estevez, Michael Gordon, Sowmya Ranganathan, and Jack Zhang",fintech,VC News Daily,2025-07-03
Remark,$16M,Series A,AI-powered e-commerce,https://vcnewsdaily.com/remark/venture-capital-funding/pqmxnslfnc,"Inspired Capital, Stripe, Neo, Spero Ventures, Shine Capital, and Visible Ventures",fintech,VC News Daily,2025-07-03
Klar,$170M,Series C,Digital financial services,,"General Atlantic, Santander, DEG, Grupo Televisa, Prosus, IFC, Mouro Capital, Quona Capital, and others",fintech,Fortune Term Sheet,2025-07-03
Civ Robotics,$7.5M,Series A,construction robotics,,"AlleyCorp, Bobcat Company, ff Venture Capital, and existing investors",other,Fortune Term Sheet,2025-07-03
TopK,$5.5M,Series Seed,Developer Search & AI,,"Earlybird, KAYA, Irregular Expressions, and angel investors",other,Fortune Term Sheet,2025-07-03
Zango,$4.8M,Series Unknown,Regulatory Compliance AI,,"Nexus Venture Partners, South Park Commons, Richard Davies, Alan Morgan, and others",other,Fortune Term Sheet,2025-07-03
2wai,$5M,Seed,holoavatar technology,https://vcnewsdaily.com/2wai/venture-capital-funding/jbrfbxblfq,,other,VC News Daily,2025-07-03
LogicFlo,$2.7M,Seed,life sciences,https://vcnewsdaily.com/logicflo/venture-capital-funding/ydbjnslkyv,"Lightspeed, and leading healthcare and enterprise AI investors",fintech,VC News Daily,2025-07-03
CRED,$15M,Seed,AI-powered predictive intelligence,https://vcnewsdaily.com/cred/venture-capital-funding/ftfnrpgtyk,"defy.vc, HOF Capital, Alumni Ventures, LDV Partners, Streamlined Ventures, SilverCircle Ventures, Octopus Ventures, BAM Ventures, Gaingels, and a leader of one of the largest PE firms",fintech,VC News Daily,2025-07-03
Gallant,$18,Series B,veterinary stem cell,https://vcnewsdaily.com/gallant-therapeutics/venture-capital-funding/rttvfdzgrf,"Digitalis Ventures, BOLD Capital, Hill Creek Partners, NovaQuest Capital Management",healthcare,VC News Daily,2025-07-03
Gensmo,$60M,Seed,AI-powered fashion,https://vcnewsdaily.com/gensmo/venture-capital-funding/gtfpnqbngm,,commerce,VC News Daily,2025-07-03
Audos Bags $11.5M Combined Pre-Seed and Seed Round,$11.5M,Seed,AI accelerator platform,https://vcnewsdaily.com/audos/venture-capital-funding/fjhbrkmkww,"True Ventures, Offline Ventures, Bungalow Capital, Bjarke Ingels, Leila Zegna, Niklas Zennstrom, and Mario Schlosser",other,VC News Daily,2025-07-03
Centific,$60M,Series A,AI Data Foundry,https://vcnewsdaily.com/centific/venture-capital-funding/jtnmcfmpjl,Granite Asia,other,VC News Daily,2025-07-03
Spekter Games,$5M,Seed,Web3 mobile gaming,https://vcnewsdaily.com/spekter-games/venture-capital-funding/fbslyffcxp,"a16z speedrun, London Venture Partners, BRV Capital, Chamaeleon, Accelerator Ventures, Impact46, Versus Ventures and Alumni Ventures",other,VC News Daily,2025-07-03
Cato Networks,$359M,Series G,Secure Access Service Edge,,"Vitruvian Partners, ION Crossover Partners, Lightspeed Venture Partners, Acrew Capital, Adams Street Partners",other,Fortune Term Sheet,2025-07-03
Levelpath,$55M,Series B,AI-driven procurement,,"Battery Ventures, Redpoint Ventures, Benchmark, 01A",other,Fortune Term Sheet,2025-07-03
Aircon,$5M,Seed,Air cargo technology,,"Blumberg Capital, Las Olas VC",other,Fortune Term Sheet,2025-07-03
Datagram,$4M,Pre-Seed,DePIN baselayer,,"Blizzard the Avalanche Fund, Animoca Brands, Cointelegraph, Amber Group, angel investors, and others",other,Fortune Term Sheet,2025-07-03
Woodchuck,$3.8M,Seed,Waste-to-energy technology,,"Mason Fink, NorthStar Clean Energy, Alloy Partners, Beckett Industries",other,Fortune Term Sheet,2025-07-03
Monit,$2.5M,Series Unknown,business spend management,,"Cento Ventures, Sansan, 1982 Ventures, Init 6",other,Fortune Term Sheet,2025-07-03
DataBahn.ai,$17M,Series A,data pipeline platform,https://vcnewsdaily.com/databahn.ai/venture-capital-funding/nxhbymmlww,"Forgepoint Capital, S3 Ventures, GTM Capital",other,VC News Daily,2025-07-03
Handspring,$12M,Series A,virtual youth therapy,https://vcnewsdaily.com/handspring/venture-capital-funding/vmzlsyrqzh,"Cobalt Ventures, NextView Ventures, nvp capital, 25madison, Arkitekt Ventures, VamosVentures, Hyde Park Angels (HPA), Cornucopian Capital, and others",healthcare,VC News Daily,2025-07-03
Foresight,$5.5M,Seed,private market data,https://vcnewsdaily.com/foresight/venture-capital-funding/myrxxcxxyy,"NEA, KDX Ventures",fintech,VC News Daily,2025-07-03
Mandolin,$40M,Financing round,specialty drug access,https://vcnewsdaily.com/mandolin-ai/venture-capital-funding/dztjjjrrnk,"Greylock Partners, SignalFire, Maverick, SV Angel, Jerry Yang, Guillermo Rauch",fintech,VC News Daily,2025-07-03
Tacta Systems Pulls In $75M Seed & Series A,$75M,Seed,robotics development,https://vcnewsdaily.com/tacta-systems/venture-capital-funding/gbwpvfjbmt,"Matter Venture Partners, America's Frontier Fund, SBVA, B Capital, EDBI, Sojitz Corporation, CDIB -TEN Capital, Yazaki Innovations Inc., B5 Capital, Tyche Partners and Woven Capital",other,VC News Daily,2025-07-03
Skynopy,$17.6M,Series A,Satellite connectivity,,"Alven, Expansion, Omnes, CNES, Heartcore",Other,Fortune Term Sheet,2025-07-03
Sceye,$15M,Series C,Stratospheric platforms,,SoftBank,other,Fortune Term Sheet,2025-07-03
chatlyn,$8.8M,Series A,hospitality AI communication,,"Smedvig Ventures, angel investors",other,Fortune Term Sheet,2025-07-03
Bonx,$8.6M,Seed,Manufacturing ERP,,"9900 Capital, Kima Ventures, Purple, OSS Ventures, Dynamo Ventures",other,Fortune Term Sheet,2025-07-03
LogicFlo AI,$2.7M,Seed,AI for life sciences,,"Lightspeed, others",other,Fortune Term Sheet,2025-07-03
Vellum Health,,Series A,Mobile IV healthcare,https://vcnewsdaily.com/vellum-health/venture-capital-funding/qmhhvxblkv,"FCA Venture Partners, Green Park & Golf Ventures, and seed round angel investors",healthcare,VC News Daily,2025-07-03
Clearspeed,$60M,Series D,risk assessment technology,https://vcnewsdaily.com/clearspeed/venture-capital-funding/fbnbchzfcb,"Align Private Capital, IronGate Capital Advisors, Bravo Victor Venture Capital, KBW Ventures, General David H. Petraeus (US Army, Ret.)",fintech,VC News Daily,2025-07-03
Xona Grabs $92M Series B Financing Round,$92M,Series B,satellite navigation,https://vcnewsdaily.com/xona-space-systems/venture-capital-funding/pvcnlyqwgz,"Craft Ventures, Stellar Ventures, Seraphim Ventures, Toyota Ventures, First Spark, Industrious Ventures, Future Ventures, and NGP Capital",other,VC News Daily,2025-07-03
Harmonic,$100M,Series B,AI math superintelligence,,"Kleiner Perkins, Paradigm, Ribbit Capital, Sequoia Capital, Index Ventures, Charlie Cheever",other,Fortune Term Sheet,2025-07-11
Renasant Bio,$54.5M,Seed,Kidney disease treatment,,"5AM Ventures, Atlas Venture, OrbiMed, Qiming Ventures",healthcare,Fortune Term Sheet,2025-07-11
RealSense,$50M,Series A,AI-powered robotics,,"Intel Capital, MediaTek Innovation",other,Fortune Term Sheet,2025-07-11
Vellum,$20M,Series A,AI development platform,,"Leaders Fund, Socii Capital, Y Combinator, Rebel Fund, Pioneer Fund, and Eastlink Capital",other,Fortune Term Sheet,2025-07-11
Woba,$13.5M,Series Unknown,Flexible office subscriptions,,"Bewater, Kaszek Ventures, Valor Capital, Endeavor Catalyst, Endeavor Scale-Up Ventures, and Citrino Ventures",other,Fortune Term Sheet,2025-07-11
Knox,$6.5M,Seed,Federal cloud services,,"Felicis, Ridgeline, FirsthandVC",other,Fortune Term Sheet,2025-07-11
BQP,$4.8M,Seed,Simulation software,,"Monta Vista Capital, Arc Ventures, Armory Square Ventures, Emergent Ventures",other,Fortune Term Sheet,2025-07-11
AirMDR,$15.5M,Series,AI-powered cybersecurity,https://vcnewsdaily.com/airmdr/venture-capital-funding/gkcttdgpbm,"Race Capital, Foundation Capital, Storm Ventures",fintech,VC News Daily,2025-07-11
Moment,$36M,Series B,fixed income trading,https://vcnewsdaily.com/moment-technology/venture-capital-funding/mkxvlmsgmj,"Index Ventures, Andreessen Horowitz, Lightspeed Venture Partners, Venrock, Neo, and Contrary Capital",fintech,VC News Daily,2025-07-11
CoRegen,$93,Financing,Cancer treatments,https://vcnewsdaily.com/coregen/venture-capital-funding/ybhjmvyhct,,healthcare,VC News Daily,2025-07-11
ServiceUp,$55,Series B,fleet and insurance,https://vcnewsdaily.com/serviceup/venture-capital-funding/zyswxhqlkh,"PeakSpan Capital, Hearst Ventures, Trestle Partners, Capital Midwest Fund, and Litquidity Ventures",fintech,VC News Daily,2025-07-11
Polimorphic,$18.6,Series A,local government services,https://vcnewsdaily.com/polimorphic/venture-capital-funding/tvqshrjwgd,"General Catalyst, M13, and Shine",fintech,VC News Daily,2025-07-11
MaintainX,$150M,Series D,maintenance and asset management,https://vcnewsdaily.com/maintainx/venture-capital-funding/nwvwvxkvph,"Bessemer Venture Partners, Bain Capital Ventures (BCV), D. E. Shaw Ventures, Amity Ventures, August Capital, Founders Circle Capital, Sozo Ventures, and Fifth Down Capital, as well as angel investors Rahul Mehta, co-founder of DST Global, and Dave McJannet, CEO of Hashicorp, among others.",other,VC News Daily,2025-07-11
Neuros Medical,$56M,Series D,direct nerve stimulation,https://vcnewsdaily.com/neuros-medical/venture-capital-funding/nzwvjqycxc,"EQT Life Sciences, US Venture Partners, Amzak Health, Osage University Partners, Sectoral Asset Management, and Aperture Venture Partners",healthcare,VC News Daily,2025-07-11
Parspec,$20M,Series A,construction procurement,https://vcnewsdaily.com/parspec/venture-capital-funding/xwxwbbtymx,"Threshold Ventures (formerly DFJ), Innovation Endeavors, Building Ventures, Heartland Ventures, and Hometeam Ventures",other,VC News Daily,2025-07-11
Airalo,$220M,Series C,eSIM provider,,"CVC, Peak XV, Antler Elevate",other,Fortune Term Sheet,2025-07-11
Varda Space Industries,$187M,Series C,space research,,"Natural Capital, Shrug Capital, Founders Fund, Peter Thiel, Khosla Ventures, Caffeinated Capital, Lux Capital, and Also Capital",other,Fortune Term Sheet,2025-07-11
Acithera,75.5M,Series A,radiopharmaceutical biotech,,"M Ventures, Hadean Ventures, Sofinnova Partners, 4BIO Capital, Bioqube Ventures, Innovestorâ€™s Life Science Fund, Investinor, Surveyor Capital, and Arkin Bio Ventures II",healthcare,Fortune Term Sheet,2025-07-11
"Aqtual, Inc.",$31M,Series B,medtech/chronic diseases,,Manta Ray,healthcare,Fortune Term Sheet,2025-07-11
Datafy,$20M,Seed,Autonomous storage optimization,,"Bessemer Venture Partners, Insight Partners",other,Fortune Term Sheet,2025-07-11
Nominal,$20M,Series A,AI-powered ERP,,"Next47, Workday Ventures, Bling Capital, Hyperwise Ventures",other,Fortune Term Sheet,2025-07-11
Dextall,$15M,Series A,Construction Tech,,"L+M Development Partners, Essence Development, Simpson Strong-Tie",other,Fortune Term Sheet,2025-07-11
Welli,$8M,Series A,healthcare fintech,,"Costanoa Ventures, Animo VC, Crestone",fintech,Fortune Term Sheet,2025-07-11
Abacus,$6.6M,Seed,Accounting automation,,"Menlo Ventures, Pear VC, Recall Capital, Original Capital",other,Fortune Term Sheet,2025-07-11
